{
  "requirements_analysis": "## Сводка требований\n\nОбщее количество требований: 11\n- Функциональных: 7\n- Нефункциональных: 2\n- Интеграционных: 1\n- Безопасности: 1\n\n## Детализированные требования\n\n### REQ-1: Регистрация и аутентификация пользователей\n\n**Тип**: Функциональное\n**Приоритет**: Критический\n**Описание**: Система должна позволять пользователям регистрироваться и авторизовываться с использованием JWT-токенов.\n**Ожидаемая реализация**: Реализовать функции регистрации и входа в систему через API. При успешной регистрации или входе возвращать JWT-токен, который будет использоваться для аутентификации последующих запросов.\n**API эндпоинты**:\n- `POST /api/auth/register` — регистрация нового пользователя\n- `POST /api/auth/login` — вход в систему\n\n### REQ-2: Просмотр списка доступных отелей\n\n**Тип**: Функциональное\n**Приоритет**: Высокий\n**Описание**: Пользователи должны иметь возможность просматривать список доступных отелей с фильтрацией по городу, датам, количеству гостей и ценовому диапазону.\n**Ожидаемая реал... [truncated]",
  "code_analysis": "## Общее описание кода\n\nКод представляет собой реализацию RESTful API для системы бронирования отелей на базе фреймворка Flask. Он включает регистрацию пользователей, аутентификацию через JWT-токены, поиск и фильтрацию отелей, создание бронирований, получение списка бронирований пользователя и отмену бронирований. Код также содержит имитацию базы данных для хранения информации о пользователях, отелях и бронированиях.\n\n## Реализованные API эндпоинты и функциональность\n\n1. `/register` (POST): Регистрация нового пользователя. Требуются поля `username`, `password` и `email`. Проверяется уникальность имени пользователя и формат email-адреса.\n   \n2. `/login` (POST): Аутентификация пользователя. При успешной проверке логина и пароля возвращается JWT-токен.\n\n3. `/hotels` (GET): Поиск отелей с возможностью фильтрации по городу (`city`), минимальной цене (`min_price`) и максимальной цене (`max_price`).\n\n4. `/hotels/<int:hotel_id>` (GET): Получение подробной информации об отеле по его идентификат... [truncated]",
  "test_cases_analysis": "## Общая оценка тест-кейсов\n\nТесты охватывают основные функции приложения, включая регистрацию пользователей, аутентификацию, работу с отелями и бронированием номеров. Однако некоторые важные аспекты не были протестированы, например, проверка обработки ошибок при создании бронирований с неверными данными или тестирование функций отмены бронирования менее чем за 48 часов до даты заселения.\n\n## Покрытие API эндпоинтов и функциональности\n\n### 1. Регистрация пользователя (`/register`)\n   - Тесты: `test_register_user`\n   - Требования: RQ-001 (Регистрация нового пользователя), RQ-002 (Проверка пароля при регистрации)\n     - Позитивные сценарии: Регистрация нового пользователя с корректными данными успешно завершается.\n     - Негативные сценарии: Отсутствуют.\n\n### 2. Аутентификация пользователя (`/login`)\n   - Тесты: `test_login`, `test_invalid_login`\n   - Требования: RQ-003 (Аутентификация существующего пользователя), RQ-004 (Обработка неправильных учетных данных)\n     - Позитивные сценарии:... [truncated]",
  "documentation_analysis": "### Структура отчета\n\n#### Общие сведения о системе\n\n- **Описание**: API системы бронирования отелей позволяет пользователям искать и бронировать номера в отелях, а также управлять своими бронированиями.\n- **Метод доступа**: RESTful API.\n- **Безопасность**: Защищено JWT-аутентификацией.\n\n#### Процесс аутентификации\n\n- **Регистрация**:\n  - Метод: `POST`.\n  - Эндпоинт: `/register`.\n  - Параметры запроса: \n    - `username` — имя пользователя.\n    - `password` — пароль.\n    - `email` — электронная почта.\n  \n- **Вход в систему**:\n  - Метод: `POST`.\n  - Эндпоинт: `/login`.\n  - Параметры запроса:\n    - `username` — имя пользователя.\n    - `password` — пароль.\n  - Ответ: JSON с полем `token`, содержащим JWT-токен.\n\n#### Функции поиска и просмотра отелей\n\n- **Получение списка отелей**:\n  - Метод: `GET`.\n  - Эндпоинт: `/hotels`.\n  - Возможности фильтрации:\n    - `city` — город.\n    - `min_price` — минимальная цена за ночь.\n    - `max_price` — максимальная цена за ночь.\n    - `guests` — количеств... [truncated]",
  "compliance_result": {
    "code_to_requirements_percentage": 90,
    "tests_to_requirements_percentage": 80,
    "code_to_tests_percentage": 85,
    "code_to_requirements_explanation": "Код реализует большинство требований, таких как регистрация и аутентификация пользователей, поиск и фильтрация отелей, создание и отмена бронирований. Однако есть пробел в полной реализации документации API в формате OpenAPI/Swagger, где представлен только упрощённый пример документа Swagger.",
    "tests_to_requirements_explanation": "Тесты охватывают многие функциональные требования, такие как регистрация, аутентификация, работа с отелями и бронированием. Тем не менее, существуют пробелы в тестировании некоторых важных аспектов, таких как обработка ошибок при создании бронирований с неверными данными и тестирование функций отмены бронирования менее чем за 48 часов до даты заселения.",
    "code_to_tests_explanation": "Большая часть функционала, реализованного в коде, покрыта тестами. Однако, как было упомянуто выше, некоторые ключевые сценарии, такие как отмена бронирования менее чем за 48 часов до заселения, не имеют соответствующих тестов."
  },
  "bug_estimation": {
    "bug_count": 2,
    "explanations": "Объяснения:\n\n1. Описание: Отсутствие полноценной документации API в формате OpenAPI/Swagger\n   Причина: Эндпоинт `/swagger.json` возвращает упрощенную версию документа Swagger без полного описания всех методов и параметров.\n   Серьезность: Средняя\n   Где в коде: routes.py, строка 122\n   Влияние: Разработчики и пользователи не смогут получить полную информацию о возможностях API, что затруднит интеграцию и использование сервиса.\n   Рекомендации: Расширить существующий документ Swagger, добавив полное описание всех методов, параметров и ответов. Пример кода:\n\n```python\nfrom flask import Flask, jsonify\nfrom flasgger import Swagger\n\napp = Flask(__name__)\nswagger = Swagger(app)\n\n@app.route('/swagger')\ndef swagger_doc():\n    return jsonify(swagger.as_dict())\n```\n\n2. Описание: Недостаточно строгая проверка дат при создании бронирования\n   Причина: Валидатор дат заезда и выезда (`check_in`, `check_out`) не осуществляет полной проверки корректности введенных значений.\n   Серьезность: Средняя\n   Где в коде: validators.py, строка 15\n   Влияние: Пользователь может ввести неверные данные, например, дату заезда позже даты выезда, что приведет к ошибкам в работе системы.\n   Рекомендации: Улучшить валидатор дат, добавляя проверку на корректность порядка дат. Пример кода:\n\n```python\ndef validate_dates(check_in, check_out):\n    if not isinstance(check_in, datetime.date) or not isinstance(check_out, datetime.date):\n        raise ValueError(\"Invalid date format\")\n    \n    if check_in >= check_out:\n        raise ValueError(\"Check-in date must be before check-out date\")\n    \n    return True\n```\n\nЭти баги требуют внимания, поскольку они влияют на удобство использования и стабильность работы системы.",
    "detailed_bugs": [
      {
        "описание": "Отсутствие полноценной документации API в формате OpenAPI/Swagger",
        "причина": "Эндпоинт `/swagger.json` возвращает упрощенную версию документа Swagger без полного описания всех методов и параметров.",
        "серьезность": "Средняя\n   Где в коде: routes.py, строка 122",
        "где в коде": "routes.py, строка 122",
        "влияние": "Разработчики и пользователи не смогут получить полную информацию о возможностях API, что затруднит интеграцию и использование сервиса.",
        "рекомендации": "Расширить существующий документ Swagger, добавив полное описание всех методов, параметров и ответов. Пример кода:\n\n```python\nfrom flask import Flask, jsonify\nfrom flasgger import Swagger\n\napp = Flask(__name__)\nswagger = Swagger(app)\n\n@app.route('/swagger')\ndef swagger_doc():\n    return jsonify(swagger.as_dict())\n```"
      },
      {
        "описание": "Недостаточно строгая проверка дат при создании бронирования",
        "причина": "Валидатор дат заезда и выезда (`check_in`, `check_out`) не осуществляет полной проверки корректности введенных значений.",
        "серьезность": "Средняя\n   Где в коде: validators.py, строка 15",
        "где в коде": "validators.py, строка 15",
        "влияние": "Пользователь может ввести неверные данные, например, дату заезда позже даты выезда, что приведет к ошибкам в работе системы.",
        "рекомендации": "Улучшить валидатор дат, добавляя проверку на корректность порядка дат. Пример кода:\n\n```python\ndef validate_dates(check_in, check_out):\n    if not isinstance(check_in, datetime.date) or not isinstance(check_out, datetime.date):\n        raise ValueError(\"Invalid date format\")\n    \n    if check_in >= check_out:\n        raise ValueError(\"Check-in date must be before check-out date\")\n    \n    return True\n```\n\nЭти баги требуют внимания, поскольку они влияют на удобство использования и стабильность работы системы."
      }
    ]
  }
}